Law Id,State,Title,Text,Enacted Date,Amended Date,Recent?,Sequence Number,Type,Agency,Significant Update Date,Expired Date,Archived Date,Repealed Date,Topic,Technology Categories,Incentive Categories,Regulation Categories,User Categories,References,Status,Status Date
11848,TX,Electric Vehicle (EV) and Natural Gas Vehicle (NGV) Weight Exemption,"EVs and NGVs may exceed the state's gross vehicle weight limits by up to
2,000 pounds (lbs.). The EV or NGV maximum gross vehicle weight may not
exceed 82,000 lbs.

(Reference [Texas Statutes, Transportation Code 621.101](http://www.statutes.legis.state.tx.us/))",2017-06-01 00:00:00 UTC,2023-06-02 00:00:00 UTC,false,65,State Incentives,"",2023-08-04 16:13:19 UTC,,,,"",ELEC|NG,EXEM,"",FLEET|GOV|IND,http://www.capitol.state.tx.us/BillLookup/BillNumber.aspx|http://www.statutes.legis.state.tx.us/|https://capitol.texas.gov/billlookup/BillNumber.aspx,amended,2023-06-02
11865,OR,Clean School Bus Grants,"The Oregon Department of Environmental Quality must use funds awarded to
Oregon through the [Volkswagen (VW) Environmental Mitigation
Trust](https://www.epa.gov/enforcement/volkswagen-clean-air-act-civil-settlement)
and deposited in the Clean Diesel Engine Fund, to award grants to owners
and operators of at least 450 school buses powered by diesel engines.
Eligible vehicles include buses that have at least three years of
remaining useful life. Grants will be available for 30%, up to \$50,000,
for the purchase of a new bus or up to 100% of the cost to retrofit a
school bus with emissions-reducing parts or technology that reduce
diesel particulate matter emissions by at least 85%. Any money not
expended under this Clean Diesel Engine Fund will fund grants for the
reduction of diesel engine emissions as matching funds under the Diesel
Emissions Reduction Act program. For more information, see the [VW
Settlement](https://www.oregon.gov/deq/aq/programs/Pages/VW-Diesel-Settlement.aspx)
website.

(Reference [Oregon Revised Statutes 468A.795-468A.807](https://www.oregonlegislature.gov/))",2017-08-16 00:00:00 UTC,,false,12,State Incentives,"",2019-12-20 16:49:43 UTC,,,,"",AFTMKTCONV|BIOD|ETH|ELEC|HEV|HY|NG|PHEV|LPG,GNT,"",FLEET|GOV,https://www.oregonlegislature.gov/|https://www.oregonlegislature.gov/,enacted,2017-08-16
11897,NY,Zero Emission Vehicle (ZEV) Rebate and ZEV Fueling Infrastructure Grant for Municipalities,"The New York State Department of Environmental Conservation's (NYSDEC)
Municipal ZEV Program offers rebates to cities, towns, villages,
counties, and New York City boroughs for the purchase or lease of
eligible ZEVs and grants for purchase and installation of public ZEV
fueling infrastructure. Rebates of up to \$7,500 are available for ZEVs
and up to \$500,000 for ZEV fueling infrastructure. ZEV rebate amounts
vary based on a vehicle's all-electric range and gross vehicle weight
rating. Municipalities may apply for multiple ZEV rebates, worth up to
\$375,000, and multiple ZEV infrastructure grants, worth up to
\$500,000. Additional rules and conditions apply. For more information,
including eligible projects and application periods, see the NYSDEC
[Grant Funding for
Municipalities](http://www.dec.ny.gov/energy/109181.html) website.
",,,false,42,State Incentives,"",2021-06-11 19:51:48 UTC,,,,"",ELEC|HY|PHEV,GNT|RBATE,"",STATION|GOV,"",,
11908,CA,Electric Vehicle (EV) Charging Station Rebate - South Coast and MSRC,"The South Coast Air Quality Management District (SCAQMD) and the Mobile
Source Air Pollution Reduction Review Committee's (MSRC) Residential EV
Charging Incentive Pilot Program offers rebates of up to \$500 for the
purchase of a qualified residential Level 2 EV charger. Funding is
available on a first-come, first-served basis to low-income residents
within the SCAQMD jurisdiction. Additional terms and conditions apply.
For more information, including application guidelines, see the
[Residential EV Charging Incentive Pilot
Program](http://www.aqmd.gov/home/programs/community/community-detail?title=ev-charging-incentive)
website.
",,,false,77,State Incentives,"",2018-01-22 13:39:39 UTC,,,,"",ELEC|PHEV,RBATE,"",STATION,"",,
11921,MN,Electric Vehicle (EV) Time-Of-Use (TOU) Rates - Xcel Energy,"Xcel Energy offers two TOU rate options for residential customers that
own an EV. The EV Accelerate at Home rate requires customers to choose
an eligible, separately metered Level 2 charger that Xcel Energy
installs and maintains. The Separate Meter rate only requires customers
to install a separate meter to measure electricity used for EV charging.
For rate information, including eligibility requirements, see Xcel
Energy's [EV Rate
Options](https://ev.xcelenergy.com/ev-charging-programs) website.
",,,false,24,Utility / Private Incentives,"",2018-02-16 14:42:07 UTC,,,,"",ELEC|PHEV,TOU,"",IND,"",,
11923,FL,Electric Vehicle (EV) Charger Incentives - Brickell Energy,"Brickell Energy's aFLoat Program offers two different incentives to
facilitate the installation of EV chargers in Florida. Through the
aFLoat Host Agreement, Brickell Energy will cover the cost of hardware,
network service plans, management service, and warranties. Eligible
hosts include commercial real estate property owners and managers. Hosts
must cover the cost of installation. The aFLoat Rental Plan offers
public and commercial locations, the EV charger hardware, network
service plan, management service, and warranties at a reduced fee.
Additional terms and conditions apply. For more information, see
Brickell Energy's [aFLoat
Program](http://brickellenergy.com/afloat-program/) website.
",,,false,44,Utility / Private Incentives,"",2018-03-09 15:04:10 UTC,,,,"",ELEC|PHEV,LOANS|OTHER,"",STATION,"",,
11925,UT,Non-Residential Electric Vehicle (EV) Charging Station Rebate - Rocky Mountain Power,"Rocky Mountain Power provides rebates to non-residential and
multi-family customers toward the purchase of Level 2 and direct current
fast charging (DCFC) station. Customers installing Level 2 EV charging
stations may receive a rebate of 75% of equipment cost, up to \$1,000
for single port stations and \$1,500 for multi-port stations. Customers
installing DCFC stations may receive a rebate of 75% of equipment and
installation cost, up to \$30,000 for single port stations and \$42,000
for multi-port stations.

Rebates are available on a first-come, first-served basis. Additional
terms and conditions apply. For more information, see the Rocky Mountain
Power [Utah EV
Incentives](https://www.rockymountainpower.net/savings-energy-choices/electric-vehicles.html)
website.
",,,false,27,Utility / Private Incentives,"",2018-03-09 22:11:27 UTC,,,,"",ELEC|PHEV,GNT|RBATE,"",STATION|IND,"",,
11934,CA,Electric Vehicle (EV) Charging Station Rebate - Burbank Water and Power (BWP),"BWP provides rebates to commercial and residential customers toward the
purchase of Level 2 EV charging stations. Residential customers may
receive a rebate of up to \$500 to purchase and install a Level 2
charging station. Commercial or multi-unit dwelling customers may
receive up to \$15,000 for the purchase and installation of Level 2 or
direct current fast charging (DCFC) stations.

Residential customers who install a charger can receive up to \$500 and
will be placed on BWP's time-of-use rate. Applications must be submitted
no later than six months from the date of purchase for commercial
customers, and no later than four months for residential customers.
Residential customers may receive an additional \$750 rebate for an
electric panel upgrade.

Rebates are available on a first-come, first-served basis. Customers in
disadvantaged communities are eligible for higher rebate amounts. For
program guidelines and application materials, see the BWP [Residential
Electric Vehicle Charger
Rebate](https://www.burbankwaterandpower.com/rebates-and-incentives) and
[Lead the Charge](https://www.burbankwaterandpower.com/leadthecharge)
websites.
",,,false,130,Utility / Private Incentives,"",2018-04-02 18:24:08 UTC,,,,"",ELEC|PHEV,RBATE,"",STATION|FLEET|MUD|IND,"",,
11944,MN,Electric Vehicle (EV) Wind Energy Promotion - Great River Energy,"Great River Energy's Revolt initiative offers customers the ability to
power an EV with 100% wind energy for the lifetime of the vehicle. The
program requires no additional cost, however standard or off-peak rates
still apply for the electricity used. For more information, see the
Great River Energy [Revolt](https://www.energywisemn.com/revolt)
website.
",,,false,38,Utility / Private Incentives,"",2018-04-13 19:30:16 UTC,,,,"",ELEC|PHEV,OTHER,"",STATION|FLEET|GOV|IND,"",,
11954,VT,Electric Vehicle (EV) Rebates - Green Mountain Power (GMP),"GMP provides residential and business customers rebates of \$2,200 for
the purchase of a new EV, \$1,000 for the purchase of a new plug-in
hybrid electric vehicle (PHEV), \$1,500 for the purchase of a pre-owned
EV, and \$750 for the purchase of a used PHEV. Customers with qualifying
low and moderate household incomes are eligible for an additional
\$1,000 rebate. EVs must have a manufacturer's suggested retail price
that is less than or equal to \$70,000. For more information, see the
GMP
[EV](https://greenmountainpower.com/rebates-programs/electric-vehicles)
website.
",,,false,22,Utility / Private Incentives,"",2019-07-09 16:52:13 UTC,2023-06-30 00:00:00 UTC,,,"",ELEC|PHEV,OTHER|RBATE,"",IND,"",expired,2023-06-30
11981,OH,Medium- and Heavy-Duty Emissions Reduction Grants,"The Ohio Environmental Protection Agency (Ohio EPA) offers grants for
the replacement or repower of eligible on- and off-road vehicles and
equipment. Eligible on-road projects include Class 4-8 trucks, school,
shuttle, and public transit buses. Eligible off-road projects include
airport ground support equipment, ferries, forklifts, port cargo
handling equipment, and freight-switcher locomotives. Eligible projects
may also include alternative fuel infrastructure if the applicant
conducts a site assessment. All vehicles and equipment must be certified
by the U.S. Environmental Protection Agency or the California Air
Resources Board. Additional terms and conditions apply. This program is
funded by Ohio's portion of the [Volkswagen (VW) Environmental
Mitigation
Trust](https://www.epa.gov/enforcement/volkswagen-clean-air-act-civil-settlement).
For more information, including application periods, see the [Ohio
EPA](https://epa.ohio.gov/divisions-and-offices/environmental-education/grant-programs/vw-mitigation-grants)
website.
",,,false,10,State Incentives,"",2022-03-03 16:30:39 UTC,,,,"",ELEC|HEV|NG|LPG,GNT,"","","",,
11985,NV,Heavy-Duty Vehicle Emissions Reduction Grants,"The Nevada Division of Environmental Protection (NDEP) administers
Nevada's portion of the [Volkswagen (VW) Environmental Mitigation
Trust](https://www.epa.gov/enforcement/volkswagen-clean-air-act-civil-settlement)
through the Nevada Diesel Emission Mitigation Fund. The fund assists
publicly- and privately-owned fleets with the replacement or repower of
model year 2009 or older medium- and heavy-duty diesel-powered vehicles.
Funding amounts vary based on vehicle, applicant, and fuel type. For
more information, including application periods and guidelines, see the
NDEP [VW Settlement Funds](https://ndep.nv.gov/air/vw-settlement)
website.
",,,false,3,State Incentives,"",2018-06-25 19:25:22 UTC,,,,"",AFTMKTCONV|BIOD|ETH|ELEC|NG|LPG,GNT,"",FLEET|GOV,"",,
11994,AZ,Commercial Electric Vehicle (EV) Charging Station Rebate - Salt River Project (SRP),"SRP offers rebates to commercial customers who install networked Level 2
or direct current fast charging (DCFC) stations. Government, non-profit,
school, and multifamily customers are eligible for higher rebate
amounts. Rebates are available in the following amounts:

::: {data-align=""center""}
  EV Charging Station Type   Standard Rebate                        Increased Rebate
  -------------------------- -------------------------------------- --------------------------------------
  Networked Level 2          \$1,500 per port; up to 75 ports       \$4,000 per port; up to 75 ports
  DCFC                       \$15,000 per port; up to three ports   \$20,000 per port; up to three ports
:::

Justice40 communities are able to receive an additional \$1,000 per
Level 2 port and an additional \$5,000 per DCFC station. EV charging
stations must be installed between May 1, 2022, and April 30, 2023.
Rebates are available on a first-come, first-served basis. For more
information, including how to apply, see the SRP [Business EV Charger
Rebate](https://savewithsrpbiz.com/rebates/evcharger.aspx) website.
",,,false,47,Utility / Private Incentives,"",2020-05-11 15:20:12 UTC,2023-07-31 00:00:00 UTC,,,"",ELEC|PHEV,RBATE,"",STATION|PURCH|FLEET,"",expired,2023-07-31
11996,NH,Residential Electric Vehicle (EV) Charging Station Rebates - New Hampshire Electric Co-op (NHEC),"NHEC offers residential customers a rebate of \$300 to install a Level 2
EV charging station. Customers may receive a maximum of two rebates. For
more information, including eligibility requirements and how to apply,
see the NHEC [Drive
Electric](https://www.nhec.com/drive-electric/#/find/nearest) website.
",,,false,28,Utility / Private Incentives,"",2018-07-06 20:58:23 UTC,,,,"",ELEC|PHEV,RBATE,"",STATION|IND,"",,
11997,NH,Electric Vehicle (EV) Time-Of-Use (TOU) Rate - New Hampshire Electric Co-op (NHEC),"NHEC offers a TOU rate to residential customers that own or lease an EV.
Customers must be able to separately meter EV charging. For more
information, see the NHEC [Drive
Electric](https://www.nhec.com/drive-electric/#/find/nearest) website.
",,,false,30,Utility / Private Incentives,"",2018-07-06 20:59:59 UTC,,,,"",ELEC|PHEV,TOU,"",IND,"",,
11999,CA,Electric Vehicle (EV) Charger Incentive Program Support,"The California Electric Vehicle Infrastructure Project (CALeVIP), funded
by the California Energy Commission, provides guidance and funding for
property owners to develop and implement EV charger incentive programs
that help meet regional needs for Level 2 and direct current (DC) fast
chargers. Level 2 EV chargers must be ENERGY STAR certified. CALeVIP
evaluates proposed EV charger incentive programs and solicits input from
stakeholders to guide the development and implementation of the
programs. CALeVIP also provides incentive funding for each program. For
more information, see the [CALeVIP](https://calevip.org/) website.
",,,false,14,State Incentives,"",2018-07-09 19:13:39 UTC,,,,"",ELEC|PHEV,GNT|OTHER,"",STATION|OTHER,"",,
12003,VT,Heavy-Duty Vehicle Emissions Reduction Grants,"Through the Vermont Diesel Emissions Reduction Grants Program, the
Vermont Department of Environmental Conservation (DEC) provides funding
to local, state and regional agencies or departments, businesses,
institutions, and nonprofit organizations for projects focused on
reducing emissions from diesel engines and vehicles. Qualifying
heavy-duty vehicles include buses and Class 5-8 trucks. Projects
eligible for funding are as follows:

-   Verified emission control technologies;
-   Verified idle reduction technologies;
-   Verified aerodynamic technologies and low rolling resistance tires;
-   Certified engine replacements;
-   Alternative fuel conversions; and,
-   Certified vehicle or equipment replacements.

All technologies and engines must be certified by the U.S. Environmental
Protection Agency. Alternative fuels include, but are not limited to,
natural gas, propane, and electricity. Cost share requirements vary by
project. For more information, including application details, see the
DEC [Diesel Emissions Reduction
Assistance](http://dec.vermont.gov/air-quality/mobile-sources/diesel-emissions/vt-diesel-grant)
website.
",,,false,5,State Incentives,"",2018-07-09 19:34:22 UTC,,,,"",AFTMKTCONV|BIOD|ELEC|HY|IR|NG|PHEV|LPG,GNT,"",FLEET|GOV,"",,
12005,CT,Loans for Residential Charging or Natural Gas Fueling Infrastructure,"The Connecticut Green Bank offers Smart-E low-interest loans for
Connecticut electric vehicle (EV) drivers to purchase Level 2 and direct
current fast chargers or natural gas vehicle fueling equipment. To
qualify, applicants must own and occupy the residence at which the EV
chargers or natural gas fueling equipment will be installed. For more
information, see the Connecticut Green Bank [Smart-E
Loans](https://ctgreenbank.com/programs/smart-e-loans/) website.
",,,false,22,State Incentives,"",2018-07-09 20:00:32 UTC,,,,"",ELEC|NG|PHEV,LOANS,"",STATION|IND,"",,
12008,CO,Electric Vehicle (EV) Charger Rebate - Gunnison County Electric Association (GCEA),"GCEA offers rebates to residential customers for the purchase of Level 2
EV charger. Eligible customers may receive a rebate for 50% of the cost
to purchase and install an EV charger, up to \$1,250. To qualify,
applicants must sign up for a time-of-use rate. For more information,
see the GCEA [EV Rebates](https://gcea.coop/ev-rebates) website.
",,,false,43,Utility / Private Incentives,"",2018-07-11 17:58:48 UTC,,,,"",ELEC|PHEV,RBATE,"",STATION,"",,
12018,VT,Electric Vehicle (EV) Charger Credits - Vermont Electric Co-op (VEC),"VEC offers a bill credit of \$500 per connector and up to \$1,000 to VEC
member businesses and public entities that install Level 2 EV chargers
or direct current fast chargers after July 1, 2017. To qualify, the EV
charger must be available for public use. VEC also offers residential
customers a \$250 bill credit for the purchase of a Level 2 EV charger.
Members with eligible chargers may receive an additional upfront \$50
incentive and an \$8 monthly incentive for participating. For more
information, including additional restrictions and how to apply, see the
VEC [Energy Transformation
Incentives](https://vermontelectric.coop/energy-transformation-programs)
website.
",,,false,32,Utility / Private Incentives,"",2020-07-11 12:19:14 UTC,,,,"",ELEC|PHEV,RBATE,"",STATION|FLEET,"",,
12021,MA,Electric Vehicle (EV) Rebate,"Residential customers of participating Massachusetts municipal light
plants (MLPs) may be eligible for a free or discounted Level 2 EV
charging station through the Massachusetts NextZero program. Incentives
vary by MLP. Additional terms and conditions apply. For more
information, including participating MLPs, see the
[NextZero](https://nextzero.org/) website.
",,,false,20,State Incentives,"",2018-08-08 15:59:10 UTC,,,,"",ELEC|PHEV,OTHER|RBATE,"",STATION,"",,
12022,NY,Electric Vehicle (EV) Charging Rate Incentive for Businesses - Con Edison,"Con Edison offers an electric rate reduction ranging from 34% to 39% for
businesses in New York City and Westchester County that install a
publicly accessible direct current fast charging (DCFC) station.
Qualifying DCFC stations must have a power output of at least 100
kilowatts. Additional terms apply. The rate reduction is available
through April 2025. For more information, including how to apply, see
the Con Edison [Business Incentive
Rate](https://www.coned.com/en/commercial-industrial/economic-development/business-incentive-rate)
website.
",,,false,68,Utility / Private Incentives,"",2018-08-08 16:04:19 UTC,2025-04-01 00:00:00 UTC,,,"",ELEC|PHEV,TOU,"",STATION|AFP,"",,
12033,VT,Alternative Fueling Infrastructure Incentive,"The Vermont State Infrastructure Bank (SIB) offers loan assistance to
municipalities, regional development corporations, political
subdivisions of the state, and private companies working for the state
to finance public electric vehicle chargers and natural gas fueling
stations. 1% fixed loans up to \$100,000 are available to
municipalities, non-profits, and private sector borrowers. Other terms
and conditions may apply. See the Vermont Economic Development
Authority's
[SIB](https://www.veda.org/financing-options/vermont-commercial-financing/electric-vehicle-charging-station-loan-program)
website for more information, including how to apply.
",,,false,6,State Incentives,"",2018-08-29 16:07:12 UTC,,,,"",ELEC|NG|PHEV,LOANS,"",STATION,"",,
12042,DE,Electric Vehicle (EV) Charging Station Rebate - Delaware Electric Cooperative (DEC),"DEC offers a one-time \$100 rebate, in the form of a bill credit and an
additional \$5 monthly billing credit during the summer to customers if
they do not charge their EVs during Beat the Peak alerts. For more
information, including eligibility requirements, see the DEC [Beat the
Peak](https://www.delaware.coop/btp/electric-vehicles) website.
",,,false,10,Utility / Private Incentives,"",2019-04-05 14:26:55 UTC,,,,"",ELEC|PHEV,OTHER|RBATE,"",IND,"",,
12045,CA,Electric Vehicle (EV) Charging Station Rebate - SCE,"Southern California Edison's (SCE) Charge Ready Program offers customer
rebates for businesses, government organizations, and multifamily
properties to install EV charging stations at business, public sector,
or multifamily dwelling locations. Rebate amounts vary, and sites
located in disadvantaged communities are eligible for additional
rebates. For more information, including eligibility requirements and
funding availability, see the SCE [Charge Ready
Program](https://www.sce.com/business/electric-cars/Charge-Ready)
website.
",,,false,114,Utility / Private Incentives,"",2018-09-07 21:09:14 UTC,,,,"",ELEC|PHEV,RBATE,"",STATION|FLEET|GOV|MUD,"",,
12046,MA,Electric Vehicle (EV) Charging Station Discount - Braintree Electric Light Department (BELD),"BELD offers customers a discount of \$250 for the purchase of a
qualified Level 2 EV charging station. To qualify, customers must enroll
in the Bring Your Own Charger Program. Additional terms and conditions
apply. For more information, including eligible EV charging station
criteria, see the BELD [Rebates and
Incentives](https://braintree-ev.ene.org/ev-charging-guide/#rebates-incentives)
website.
",,,false,18,Utility / Private Incentives,"",2018-09-07 21:13:49 UTC,,,,"",ELEC|PHEV,OTHER,"",STATION|IND,"",,
12047,MA,Electric Vehicle (EV) Charging Incentive - Braintree Electric Light Department (BELD),"BELD's Smart Charging Program offers a bill credit of \$8 per month to
customers that charge their EVs during off-peak hours. Additional terms
and conditions apply. For more information, see the BELD [Rebates and
Incentives](https://braintree-ev.ene.org/ev-charging-guide/#rebates-incentives)
website.
",,,false,19,Utility / Private Incentives,"",2018-09-07 21:14:47 UTC,,,,"",ELEC|PHEV,OTHER,"",STATION|IND,"",,
12053,OK,Alternative Fuel Vehicle (AFV) and Infrastructure Grants for Public Fleets,"Under the Creating Long-term Energy Alternatives Now by Advancing
Improvements Regionally (CLEAN AIR) Grants program, the Association of
Central Oklahoma Governments (ACOG) issues grants for alternative fuel
and advanced technology vehicle projects in the Oklahoma City Area
Regional Transportation Study (OCARTS) area. Projects must provide a
reduction in vehicle equipment emissions and cannot increase the number
of vehicles in applicant fleets. Eligible projects may also include AFV
fueling stations or charging infrastructure. Eligible applicants include
OCARTS-member governments, certain public trusts and public authorities
providing essential services to OCARTS-member governments, member entity
public transit fleets, and public-school fleets whose district
boundaries are contained partially or wholly within the OCARTS area. For
more information, including open solicitations, see the ACOG [CLEAN AIR
Grants for Public
Fleets](https://www.acogok.org/transportation-planning/air-quality/fleet-conversion-grants/)
website.
",,,false,64,Utility / Private Incentives,"",2018-09-10 13:53:14 UTC,,,,"",BIOD|ETH|ELEC|EFFEC|HY|IR|NG|PHEV|LPG,GNT,"",STATION|FLEET|GOV|TRANS,"",,
12059,CA,Residential Electric Vehicle (EV) Charging Station Rebate - Pasadena Water and Power (PWP),"PWP provides rebates of \$600 for residential customers toward the
installation of a WiFi enabled EV charging station, or \$200 toward the
installation of a non-WiFi enabled EV charging stations. Additional
terms and conditions apply. For more information, including how to
apply, see the PWP [Residential EV and Charger Incentive
Program](https://ww5.cityofpasadena.net/water-and-power/residentialevrebate/)
website.
",,,false,134,Utility / Private Incentives,"",2018-09-12 21:00:43 UTC,,,,"",ELEC|PHEV,RBATE,"",STATION,"",,
12060,CA,Electric Vehicle (EV) Rebate - Pasadena Water and Power (PWP),"PWP provides rebates of \$250 to residential customers who purchase or
lease an eligible new or pre-owned EV. An additional \$250 is available
for eligible EVs purchased or leased from a Pasadena dealership.
Customers participating in PWP's income-qualifying programs may also
qualify for an additional \$1,000 rebate, for a total of \$1,500.
Customers may receive rebates for up to 2 EVs per address every 3 years.
Additional terms and conditions apply. For more information, see the PWP
[Residential EV and Charger Incentive
Program](https://ww5.cityofpasadena.net/water-and-power/residentialevrebate/)
website.
",,,false,116,Utility / Private Incentives,"",2018-09-12 21:03:35 UTC,,,,"",ELEC|PHEV,RBATE,"",IND,"",,
12066,WI,Heavy-Duty Transit Bus Grants,"The Wisconsin Department of Administration (DOA) offers grants for the
replacement of eligible public transit buses. Funding is available for
the replacement and scrapping of model year 1992-2009 heavy-duty public
transit buses with new replacement diesel or alternative fueled buses.
The program is funded by Wisconsin's portion of the [Volkswagen
Environmental Mitigation
Trust](https://www.epa.gov/enforcement/volkswagen-clean-air-act-civil-settlement).
For more information, including how to apply, see the DOA [VW Mitigation
Program](https://doa.wi.gov/Pages/vwsettlementwisconsin.aspx) website.
",,,false,10,State Incentives,"",2018-10-02 20:41:05 UTC,,,,"",BIOD|ETH|ELEC|HY|NG|PHEV|LPG,GNT,"",FLEET|GOV|TRANS,"",,
